date,from,to,text
2006-01-20T15:57:00.000Z,lightbright,sethk,"its ok I wont bother!  I did: 'sudo dd if=/dev/zero of=/dev/hdb1' and thats all I will do :)  Ill trust that it wiped my hdb1, no need to check :P"
2006-01-20T15:58:00.000Z,sethk,lightbright,it did  :)
2006-01-20T15:58:00.000Z,lightbright,sethk,so I just remembered that there was a file I needed on hdb1!  How can I undelete it now?
2006-01-20T16:00:00.000Z,lightbright,sethk,why does it now say: /dev/hdb1              16T   16T     0 100% /mnt
2006-01-20T16:10:00.000Z,lightbright,sethk,what did you do to me? :P  now my hdb1 wont mount anymore
2006-01-20T16:10:00.000Z,sethk,lightbright,"of course not, you wiped it"
2006-01-20T16:11:00.000Z,lightbright,sethk,hehe ok!  ill type: mkfs -t ext3 /dev/hdb1
2006-01-20T16:11:00.000Z,sethk,lightbright,ok.  I use mkfs.ext3 /dev/hdb1  but the result is identical
2006-01-20T16:11:00.000Z,lightbright,sethk,ah ok
2006-01-20T16:12:00.000Z,lightbright,sethk,so sudo mkfs.ext3 /dev/hdb1 gives the exact same results as: mkfs -t ext3 /dev/hdb1 ?
2006-01-20T16:12:00.000Z,sethk,lightbright,hes
2006-01-20T16:12:00.000Z,lightbright,sethk,hes?
2006-01-20T16:12:00.000Z,sethk,lightbright,"yes, that is"
2006-01-20T16:13:00.000Z,lightbright,sethk,ok :)
2006-01-20T16:13:00.000Z,lightbright,sethk,does hdb1 need to be mounted for that command?
2006-01-20T16:14:00.000Z,sethk,lightbright,"you can't mount it before you make the file system, so the answer had better be no.  :)"
2006-01-20T16:14:00.000Z,lightbright,sethk,"ignorare that last question, I realised after I asked it :P"
2006-01-20T16:16:00.000Z,lightbright,sethk,ok all finished!  my hdb1 has been wiped clean!  Now the feds cant even undelete it according to some people :P
2006-01-20T16:16:00.000Z,sethk,lightbright,"the data is no  longer there, that is correct."
2006-01-20T16:16:00.000Z,lightbright,sethk,yes but surely there is a way to get it with special hardware etc?
2006-01-20T16:17:00.000Z,sethk,lightbright,"no, not really.  you can't get the data back when the data is gone."
2006-01-20T16:17:00.000Z,lightbright,sethk,hmm interesting
2006-01-20T16:17:00.000Z,sethk,lightbright,"I suppose it might leave quantum traces, but I don't think anyone has a way of gathering information from taht"
2006-01-20T16:18:00.000Z,lightbright,sethk,how can I hear of so many people getting their computers ceased which was wiped and they find data on them?
2006-01-20T16:18:00.000Z,sethk,lightbright,because they didn't really wipe them.  They just repartitioned and did mkfs
2006-01-20T16:18:00.000Z,sethk,lightbright,you actually wrote over all the data with zeroes
2006-01-20T16:19:00.000Z,lightbright,sethk,ah ok!  well sudo dd if=/dev/zero of=/dev/hdb1 seems like a great secure command then!  Thanks for all your help
2006-01-20T16:19:00.000Z,sethk,lightbright,"if you do mkfs on a partition, it will appear to you to be empty, but in that case it is in fact recoverable, or at least much of it is."
2006-01-20T16:19:00.000Z,sethk,lightbright,"yes, writing over every sector of the disk is very very safe"
2006-01-20T16:19:00.000Z,lightbright,sethk,should I do that more than once?
2006-01-20T16:20:00.000Z,lightbright,sethk,do I need to type: sudo dd if=/dev/zero of=/dev/hdb1' more than once. like 35 times or something?
2006-01-20T16:20:00.000Z,lightbright,sethk,why are there some qipe programs that wipe 35 times if once is all thats needed?
2006-01-20T16:22:00.000Z,sethk,lightbright,I can't imagine.  Writing zeroes once is the same as writing zeroes a million times.  There has never been a case of data being recovered from a disk where all the sectors were wiped.
2006-01-20T16:22:00.000Z,sethk,lightbright,"now, if you wanted to be totally paranoid, it still makes no sense to write repetatively.  You can write all 1's, then all 0's"
2006-01-20T16:22:00.000Z,sethk,lightbright,but the possibility of recovering the data after writing over it is so small as to be effectively zeroes.
2006-01-20T16:23:00.000Z,sethk,lightbright,"I've done this for military projects, so I've studied the issue."
2006-01-20T16:45:00.000Z,lightbright,sethk,why are there some wipe programs that wipe 35 times if once is all thats needed?
2006-01-20T16:46:00.000Z,lightbright,sethk,?
